movie_id,user_id,rating_val,review_text
an-elephant-sitting-still,jca,,Imagine committing suicide over a running time dispute with one's financiers. And further imagine getting one's way passive aggressively only to be owned after death by ones's own hubris with an unnecessarily long film full of bad faith arguments.
sleep-has-her-house,jca,,"The kind of film that functions as an unintentional parody of the avant-garde. Made on an iPhone, by a bourgeois art student, at his Welsh country estate. A pastiche of influences slavishly reproduced for film festival success. Young Barley pulls the same sleight of hand of some of his heroes like David Bowie and Thom Yorke on Kid A; by lifting elements of better artworks and throwing them in a goulash meant to elicit critical praise, without saying anything original or profound."
eternals,jca,,The Oscar bait limited hangout to MCU US State department propaganda pipeline is real.
the-florida-project,milo_olim,8,Love it we need more movies fromThe pov of kids! Kids are so funny and natural Ik all their dialogue was improvised in this and that makes me love it sm more
alien-3,milo_olim,,Boring ahh movie wtf is this editing😭and pacing😹also visually the same all throughout like the set design gets mad uninspired. Lot of mid alien movies but I still love this shit
shallow-hal,milo_olim,4,lol I forgot how problematic this is
challengers,milo_olim,,"Haven’t actually seen this yet, I just know I’m gonna love the scene where zendaya shoves the tennis ball up bros butt, or that’s what I’ve heard at least from other people but I tak their word for everything so why would they lie… also the tennis racket scene 👀50 shades of tennis green"
the-dead-dont-die-2019,milo_olim,5,The movie don’t good
furiosa-a-mad-max-saga,milo_olim,8,This shit actually buss so much more than anticipated… was worried Chris hemsworth was gonna ham it up…and he did…but it’s cool tho this shit was visually striking and high octane adventure for the whole fam💯‼️
paul-blart-mall-cop,milo_olim,6,Rainy Rodriguez acted the fuvk outta this
dancer-in-the-dark,milo_olim,7,Bjorks 8 mile
ted,milo_olim,5,Fuck u thundah
zack-and-miri-make-a-porno,milo_olim,1,"This movie sucks ass, the screenplay was written by a monkey"
matilda,milo_olim,10,Onmaway
love-actually,t0mhepplest0n,8,"🫵🏼 “Look, look, it’s ___ from ___!” final boss of a film."
smile-2-2024,t0mhepplest0n,8,"Insane upgrade to the first film in every aspect. The uncomfortable ambiences generated a feeling within me where the tense and close up moments became eerily memorable. Unique in its sound technique and style of intro, this film can only be comparable to ‘Longlegs’ for me, except in its gore, as it then compares to ‘The Substance’.The mini plot twists throughout were exceptionally hooking, clever was the visual pacing and Naomi Scott delivers an unbelievable performance.We’ve really had some good films this year."
wicked-2024,t0mhepplest0n,7,Never thought I’d see the day a bear and a wolf deliver a baby Shrek…
seven-psychopaths,t0mhepplest0n,6,"A film within one. The ending itself proves the Shih Tzu breed are the most wonderful mammals to roam the earth, no doubt in my mind.Colin Farrell plays a decent bloke, Sam Rockwell is hilarious in his role, Woody Harrelson a class act, and so was Mr. Walken, especially in summarising the storyline under gleaming sun rays, following a shocking event, further impacting his role in the narrative."
my-wife-my-abuser-the-secret-footage,t0mhepplest0n,7,"What a horrible, spiteful bitch Sheree is. Richard is such a brave and unselfish father, I hope he now feels some relief in all that has happened, absolute disgrace how 20 years of inflicted abuse warrants only 4 years in prison nowadays!"
dahmer-monster-the-jeffrey-dahmer-story,t0mhepplest0n,9,"Evan Peters (Brewskis) absolutely aced this role, though I can only hope he’s fully recovered from the trauma he developed 😳 “Silenced” 😥"
its-whats-inside,t0mhepplest0n,9,"The psychological effort that went into this one is highly commendable and impressive, having me non-stop thinking for a good hour and 40 minutes."
the-menendez-brothers,t0mhepplest0n,7,"Absolutely absurd how normalised physical abuse was back then, especially in public, and even more so how the sexual abuse against boys was so unheard of."
monsters-2024,t0mhepplest0n,8,Very well-acted. Javier Bardem is insanely accurate as a villain once again.
joker-folie-a-deux,t0mhepplest0n,4,"Can’t read my, can’t read myNo he can’t read my Joker faceMr. Fleck now sings more than uncontrollably laughing…"
cuckoo-2024,t0mhepplest0n,4,Thought my shit bugged a few times throughout + the screaming aggressor’s spawn rate was too frequent for my liking. A rather confusing end to a rather cuckoo tale.
terrifier-3,t0mhepplest0n,6,Terrifier 3 was a decent film until they completely ruined it in one final act.
the-babysitter-killer-queen,thecloser79,6,"Two years ago, “The Babysitter,” a cheeky horror comedy on Netflix, was able to entertain me on a superficial level. This was about a young teenager who has to go through the scariest and cruelest night of his life when his sexy minder and her friends turn the peaceful night into an enormously bloody and satanic one. But he survived. Traumatized and without anyone believing him, but still alive. Now, two years later, he is confronted with the ""evil"" again,…"
the-new-mutants,thecloser79,5,"X-Men meets Nightmare on Elm Street!Always wanted to see a softened, worse version of ""Nightmare on Elm Street 3 - The Dream Warriors""? Then ""New Mutants"" is exactly your film.You could leave a review of this film at these sentences, but let's not be like that.More than three years after the shooting and more than two years after the planned release date, “The New Mutants” is now coming to the cinema - what a torture and suffering…"
v-for-vendetta,thecloser79,9,"The mysterious, masked V tries on the one hand to overthrow a tyrannical regime and on the other hand to come to terms with his personal past with a series of publicly effective ""actions"". That the dictatorship shown was built on the ground of an epidemic shows how incredibly visionary Alan Moore was as the author of the comic and so the creative minds behind the film were. It is unbelievable how much some ""civilized"" states are moving in this…"
bill-ted-face-the-music,thecloser79,6,"Although a fan of the first two films, I was still skeptical when it was said that “Bill & Ted 3” was really going to happen. And the first pictures and trailers didn't immediately turn into enthusiasm. In addition, the (too) late sequels and reboots (""Jay and Silent Bob""), which (lately) have really been screwed up, are simply frighteningly outnumbered, seem outdated and unnecessary. But ""Bill & Ted Face The Music"" is a worthy continuation of the saga, a successful end to…"
tenet,thecloser79,7,"A (as objective as possible) evaluation of ""Tenet"" proves to be extremely difficult. I try to explain the reasons for this without spoilers! in this review.There is probably more pressure on ""Tenet"" than on any other film in ages. As if the huge budget, the given freedoms, the prestigious participants, the name and the Nolan brand, the extremely high expectations and the complicated concept that went with it didn't pack enough weight into the backpack - now this abstract…"
2001-a-space-odyssey,thecloser79,10,"Cinema has rarely been more beguiling and disturbing, more demanding and growing in you. Without Kubrick's mysterious masterpiece, the genre of stars and future science would not be what it is today. Stanley Kubrick made a number of great films, guide books, audience splitters and mindblowers in his lifetime - with ""2001 - A Space Odyssey"" he surpassed himself. New limits, new experiences, new ideas. Without this philosophical pamphlet there would be no ""Star Wars"" or ""Dark Star"", no ""Moon"",…"
the-ring-2002,thecloser79,9,"Gore Verbinski had a few poor movies recently, but which director is free of mistakes and weaker films in his filmography. His ""The Ring"" remake from 2002 still has a lasting effect today. Together with ""Rango"" and the first ""Pirates of the Caribbean"" it is without a doubt his best film. The quieter Japanese original deserves the innovation points, but the American remake is at least as good. It is even one of the best US remakes of a foreign…"
from-dusk-till-dawn,thecloser79,8,"Writing about genre-changing films is always fun. No matter if it's a box-office hit, no matter how often you've seen it or everything has actually already been written.""From Dusk Till Dawn"" is one of those Guilty Pleasures, a genre bastard that you don't need to be ashamed of today, that has performed excellently and that even people which don't like this type of movie like. Cult in the truest sense of the word. Not art but damn fun; not…"
transformers-the-last-knight,thecloser79,1,"In the fifth (and hopefully last) part of the (main) Transformers series, maker Michael Bay finally takes it to the extreme on all fronts. Which, who followed the series, is more a threat than praise. The story of the variable giant robots is once again complete rebuilt and rewritten, this time connected to the Arthurian legend and mixed into a large, explosive broth. The action threatens the whole world more than ever, even two. The next thing should be the…"
american-gangster,thecloser79,8,"The true story of one of the most powerful drug lords in the United States: Frank Lucas builds a crime empire in New York at the time of the Vietnam War, he bribes the police, judges and prosecutors and allies himself with the mafia families to protect himself from competition. Only one man stands in his way: the drug investigator Roberts.Director Ridley Scott tells the rough gangster story with epic breath and big pictures. The excellent, mostly calm camera…"
the-fall,thecloser79,10,"A special film requires an unusual introduction and so I would like to quote the famous film critic Roger Ebert, who gave ""The Fall"" full marks: ""You might want to see [it] for no other reason than because it exists. There will never be another like it. "" An opinion that I can only agree with.Roy Walker is in hospital after an accident. He can neither get up nor walk. Little Alexandria is also there due to a fall…"
fargo,thecloser79,9,"Fargo - another exceptional work by the Coen brothers, which attracted a lot of attention with its atypical style and received loads of positive reviews and prices - rightly so, in my opinion. Because this unusual thriller grotesque with excellent actors and an extraordinary script can really worth to be seen in all respects.Car dealer Jerry Lundegaard has fed up with it. In his job he doesn't make any headway, his family is just annoying and his stingy father-in-law…"
lilo-stitch,lykonos,8,"Stitch getting rejected by his society, doing crime, and finding his chosen family? gay. but Pleakley? wig ON, bob CUT !! mamma really free bled in the xeno-feminist shower and waffle stomped gender down the cunt drain for the dolls. slay!!!"
finished,lykonos,9,"kind of a gorgeous meta-film on the illusion of cinema through the illusion of gay porn and how it relates to broader working class issues. Alain, who seems to be a proto-accelerationist, has rightfully discovered the futility of reform and activism as means of propping up a decaying system. instead, he now stands at the crossroads of mortality and suffering, torn between remaining within the failed systems of capitalism, gender, sexuality, and life itself, or surrendering to the void, whether…"
viet-and-nam,lykonos,10,"In mythologising Vietnam, the country can be split into two: Việt, holding the breadth of Vietnamese spirit, and Nam, the South, and the word for male. Vietnam has long seemed a land torn between its own desires and the shadows of colonialism cast over its collective mind. What emerges is a people, bruised and weary, with a soul aching for a reckoning, for the right to name their own longings.It is often described in a pledge to our parents:…"
you-burn-me,lykonos,5,"somewhere between david gatten's great work on the visual aspect of reading and a modern visual representation of pavese's mythological text, 'you burn me' fails to carve a strong voice in its retelling and extension of the story of Sappho.perhaps i went in with wrong expectations, but the film's over-reliance on a translated text, in what attempts to be a work of visual poetry, seems to lose much of its potency when it's translated into spanish and then subtitled…"
megalopolis-2024,lykonos,4,"bro got high on shrooms, watched some situationist and new american cinema avant garde films and thought ""yeah I could do that. how hard could it be?"" then shit out one of the highest budget student films to ever exist.nothing but mad respect."
venise-nexiste-pas,lykonos,9,"It really does seem like Rousseau has come to the full realisation that there is no self, there are no inherent platonic essences in our reality, and all we can do is haphazardly partake in the art of crafting meaning from chaos. I had a strong suspicion that 'The Enclosed Valley' was about the beckoning of the void of the self, one which Rousseau might have fallen into after his separation with his ex-boyfriend. Now, with the more explicit 'Venise…"
meridian-oder-theater-vor-dem-regen,lykonos,9,"Somewhere between Mekas and Benning, Neumann carves out his unique voice in the cinematic landscape. His technique, fluidly alternating between sharp cuts and gentle pans, draws the viewer into a profound state of appreciation, urging recognition of beauty's deep simplicity. Colours harmonize, and shapes across frames engage in a visual dialogue. Waves rhythmically crash along our mental shorelines, compelling us to perceive the world authentically, unfiltered by conventional narratives.Though this represents a remarkable foray into landscape cinema, I think…"
high-school-musical,lykonos,10,"If you really think about it, this movie can be read as an early meta-modernist critique of the restrictive confines of identity, interpreted through a Foucauldian lens on the education system and the panoptic dynamics of social groups. These groups not only enforce their literal performances on stage but also their Butlerian performance of identity off stage. It is only when the façade of rigid egos and the boundaries between film, theatre, and 'real life' dissolve that we truly start breaking free."
carrots-peas,lykonos,9,"It's wild to think that a concept I picked up in my childhood watching 'Futurama' would later deepen my understanding of experimental film. During an audio commentary, Billy West, a voice actor on the show, dispelled the myth that 'peas and carrots' was a go-to phrase for extras aiming to avoid stealing focus in scenes. In a drastic inversion of this mundane phrase, Frampton's 'Carrots and Peas' places a mirror toward the cinematic concept of background dialogue, exploring the layers…"
zorns-lemma,lykonos,10,"Genius, beyond (quite literally) words.Frampton brilliantly penetrates not only the essence of cinematic language but also the inner workings of the mind. Exploring learning and memory, repetition fosters inner narratives that transcend conventional plots and characters, encouraging thoughts to interact, doubt, and converse with themselves, thus giving space to viewers to notice what is usually unnoticed.Embedded, subconscious meanings in images and words surface as revelations, rising to the fore through contrast and rhythm, further elevated by the passage…"
light-years-1986,lykonos,9,"there's something remarkable about the way Nelson intertwines the chilling embrace of colder seasons with the senescence of fruit and flora, using shades of grey watercolours to challenge the conventional beauty of snow and rain.the film murmurs in Swedish, with dour landscapes and subdued imagery but never seeking to provide discomfort. melancholy but indomitable, imperfections become illuminations, worms, typically harbingers of decay, resonate like nature’s guitar strings, strumming from chords of decomposition to harmonies of contemplation. the frostbitten symphony lyrically lies in the eternal cycle, echoing into the void with the enduring notes of F♯ A♯ ∞"
eventide-2022,lykonos,8,"fun fact, the word ""influence"" comes from old french meaning, ""emanation from the stars affecting one's fate"", and yet, we often look in all the wrong places for ""answers"" on how to affect the trajectories of our lives."
gladiator-ii,mrsinemax,7,"Kariyerinin sonbaharında emekliliğine direnmeye devam eden Ridley Scott dedeciğimin son dönemlerdeki projelerinin sıklığı göz önünde bulundurulduğunda, niceliğe nitelikten daha çok önem verdiğine şüphe kalmıyor. The Last Duel ve The Martian gibi istisnaların bozmadığı kaidenin endişesiyle izlediğim Gladyatör II; gayet sürükleyici, keyifli bir seyirlikti. Hem senaristi, David Scarpa’nın Napolyon’da çıkardığı rezalet iş hem de internetteki kötü yorumların çoğunluğu sebebiyle beklentimi istemsizce düşürdüğümden midir bilinmez; çoğunluğun neden filmi yerden yere vurduğunu pek anlamamakla birlikte, açıkçası beğenilmeyen kısımlara üretilen argümanları da yeterince makul…"
the-substance,mrsinemax,7,Bir haftalık kullanımın ardından eski formunuza geri dönmek şartıyla düzenli bir şekilde gençliğinize erişmenizi sağlayacak bir aşının fikri dahi ucuz duracak birçok kötü yapıma kapı açabilecek nitelikte. The Substance bu sürreal konsepti işlerken zaman zaman istemsizce kazdığı çukurda tökezlese de; halen günümüz sinemasında tümüyle özgün sayılabilecek nadir anlatılardan birine sahip. Epeydir görsel bakımdan birbirinden farksız projelere maruz kaldıktan sonra sinematografi tarafında kreatif kararlar alan bir film seyretmek zevkliydi. Birçok sahnede yalnızca iki plan bulunurken kimisindeyse dakikalarca tek bir açıda kalıyoruz.…
rebel-ridge,mrsinemax,6,"Hiçliğin ortasındaki bir kasabada, yozlaşmış polise karşı intikam arayan karizmatik gazi kahramanımızın verdiği mücadele pek çok açıdan Reacher'ı hatırlatsa da; Rebel Ridge'in halen özgün sayılabilecek unsurları bulunuyor elbet. Açılıştan itibaren hız kesmeden temposunu arttıran bir anlatıya sahip olmasını beğendim. Daha ilk sahneden kahramanımız tehlikeye istemsizce balıklama atlıyor. Ayrıca havalı kişiliği ve insanüstü yeteneklerine rağmen hazırlıksız yakalandığında onun bile çaresiz olduğunu göstermeleri süperdi. John Wick, Jason Bourne ve benzeri karakterlerin oda dolusu figüranı birkaç hamleyle alt etmesi ne kadar muazzam görünse…"
pele-birth-of-a-legend,mrsinemax,5,"Dünyaca ünlü futbolcunun biyopiğini; klişelerle dolu, tempo yönetiminden muzdarip, potansiyelini tümüyle değerlendirmeyen bir anlatı üzerinden seyretmek bir nebze üzdü. Hayli basmakalıp hikaye noktaları görmek bir noktadan sonra usandırıyor. Bir de Pelé'ye çocukluğunda dahi geleceğin yıldızıymış gibi ithaf edilmesi, hikayenin inandırıcılığını zamanla yitirdi.Eh işte, yıllar sonra televizyon kanalından düşük çözünürlük ve bol reklamla film izleyince dijital platformların varlığına bir tur daha şükrettim."
venom-the-last-dance,mrsinemax,4,"Ölümcül Koruyucunun son eklentisi olan Venom: The Last Dance’i, öncüllerine duyduğum hoşnutsuzluğa rağmen olabildiğince nötr beklentilerle seyrettim. Açıkçası dudağımı uçuklatacak, şahane bulacağım bir yapımla karşılaşmayı ummazdım… desem yer misiniz?İlk iki filmin senaryosunda imzası bulunan Kelly Marcel’in daha kalemi güçlü değilken bu sefer de yönetmenlik koltuğuna oturması, yokuş aşağı giden üçlemenin rezalet bir şekilde noktalanacağının habercisiydi zaten. Ayrıca ilk direktörlük tecrübesi olması da cabası.Seriyi sonlandıracak bir anlatıdan ziyade geçmişteki yapımları göz ardı eden, sanki yıllardır devam eden bir üçlemenin…"
paddleton,mrsinemax,6,"Yediği içtiği ayrı gitmeyen iki komşunun topluma ayak uydurmaması yüzünden yalnızca birbirlerinde bulduğu sıkı dostluk, içlerinden birinin tedavi edilemeyecek raddede olan kansere yakalanmasıyla nihai sonuna yaklaşır.Paddleton’ın hem yazarı hem baş rolü hem de yapımcısı olan Mark Duplass’ın kariyer hedeflerimi oluşturmamdaki rolü büyüktür. Yaklaşık dokuz yıl önce, South by Southwest film festivalinde, benim gibi sinema sektörüne atılmak isteyen gençlere yaptığı bir saatlik konuşmada Hollywood’un nasıl işlediğinden ve çekmek istediğiniz projeyi hayata geçirmek için geleneksel yöntemleri kovalamaktansa kendi kaynaklarınızla ne şekilde…"
mean-girls,mrsinemax,7,"Yeni okul hayatına atılan bir kızın ilk günden itibaren zorbalandığı ve köşeye itildiği bir hikaye düşünün. Yaşıtlarından hayli saf ve zeki olduğu için durmadan örselenen bu kız; cesaretini toplayarak hoşlandığı çocuğa açılır, etrafındakilerle arkadaşlık kurar ve tüm problemlerini çözümler. Konuştuğu kişiyle göz teması bile kuramayan, içine kapanık, çirkin görülen birisiyken artık okulun hem en popüler hem de en güzel öğrencisine dönüşmüştür. Fakat mutlu olmasını sağlayacak her şeye sahip olsa da, başkalarının tatmini için yaşamanın anlamsız olduğuna kanaat getirip oluşturduğu yeni…"
watcher,mrsinemax,6,"Terfi edilmesiyle New York’tan Bükreş’e taşınan bir adamın peşinden sürüklenen eşi; hem dili hem de kültürüne yabancı olduğu bir ülkede, karşı binalarındaki bir kimliksizin kendisini durmadan dikizlediği bir apartmanda mahsur kalır.Rear Window’un gayriihtiyari torunu olan Watcher; yönetmen ve senaristinin ilk uzun-metraj projesi olduğunu birçok bağlamda belli etmesine rağmen halen titizlikle hazırlanmış sürükleyici anlatı hissiyatı veriyor. Özellikle Hitchcock’a kafa tutarak komşularını gözlemleyen kahramanımızın yakalandığı esnada kendisini, onu fark eden kişinin bakış açısından görmek istediğimi belirtmiştim. Fakat usta direktör oluşturduğu sinematografik…"
beverly-hills-cop,mrsinemax,5,"Boşboğaz, alık, yersiz espriler yapan, ukala, asi ruhlu fakat bir yandan da insan sarrafı olan sivri zekalı, siyahi dedektif arketipi yıllar içinde epey yaygınlaşmaya başladı. Shaft, Bad Boys, Rush Hour, Ride Along, Cop Out… anlayacağınız elini sallasan ellisi. Beverly Hills Cop’ın merkezindeki Axel Foley’de bu basmakalıp role tamı tamına uymakta. Elbette böylesine bir yapım yalnızca sıradan olduğu için taşlanmamalı, ne de olsa vizyon tarihini hesaba katarsak türünün ilk örneklerinden birisi. Asıl sıkıntısı, kendi kulvarında dahi zayıf kalması.Axel Foley, gerçek…"
o-brother-where-art-thou,mrsinemax,6,"Günümüz şartları altında katiyen çekilemeyeceğini düşündüğüm O Brother, Where Art Thou?; Coen Biraderlerin yine absürt komediyle deneysel bir anlatı oluşturduğu başka bir yapım. Şahsen filmi izlemenin iki yolu var: ilki, nükteli diyaloglardan sahnelerin tuhaflığına kadar her komik unsurun keyfini çıkarıp gösterilenlere etraflıca kafa yormamak. İkincisiyse abuk bulunan her ögeyi irdeleyerek hikayedeki alt metnin peşine düşmek. Örneğin ren raylarında karşılaşılan kör siyahinin kehaneti veya ruhunu şeytana satan müzisyenin anlaşması kapsamlı bir şekilde araştırılabilir. Ya da mevzubahis kehanette olacağı söylenilen saçmalıkların nasıl…"
kingdom-of-heaven,mrsinemax,8,"Bu eleştiriyi yazarken üç reklam, iki kısa-film, bir tane de uzun metraj çeken seksen altılık Ridley Scott’ın nasıl bu kadar fazla başarılı projeye imza attığını kavramak hakikaten güç. Reisin üç tane çocuğu da var. Herhalde mercimeği fırına verip durmadan sete geri dönüyor. Alien ve Blade Runner gibi projelerle bilim-kurgu dalında ne kadar becerikli olduğunu kanıtlasa da; aynı zamanda Gladyatör, The Last Duel ve incelemenin merkezindeki Kingdom of Heaven ile tarih dramalarında da marifetini konuşturarak birden fazla janraya egemen olduğunu ispatlamış…"
warrior,mrsinemax,8,"Alkolik ve istismarcı bir babanın himayesinde büyüyen iki kardeş, olgunlaştıkça hayatın farklı köşelerine savrulur. Yıllardır birbirini görmeyen bu ikilinin yolları; birinin geçmişinden kaçmak, öbürünse ailesini hacizden kurtarmak için katıldığı dövüş turnuvasında yeniden kesişir.Warrior; açılış sekansındaki babayla yüzleşme anından itibaren türdeşlerinden farklı olduğunu, havalı kavga sahnelerine odaklanmaktansa sayısız yumruğa bedel travmaların karakterlerin üzerindeki etkisine odaklanarak kanıtlıyor. Özellikle diyaloğun bu kadar akıcı, nükteli ve alt metinle dolu olmasını beklemiyordum. Sıradan gözüken bir sohbetle kardeşlerin geçmişi hakkında o kadar çok şey öğreniyoruz…"
south-park-bigger-longer-uncut,ttsquared77,10,Finally watched my 4k
the-last-waltz,ttsquared77,9,How have I never watched this before?
broadcast-news,ttsquared77,10,Name a more iconic trio
before-sunrise,ttsquared77,10,Linklater is the master of making two people talking the most compelling thing you’ve ever seen
atomic-blonde,ttsquared77,7,New Order in an action movie is all I need
maxxxine,ttsquared77,8,Somehow the face molding is the scariest
virtuosity,ttsquared77,7,The kind of dumb fun movie I love
nightmare-at-shadow-woods,ttsquared77,2,Awful but so much fun seeing this with a big crowd. Great screening!
toy-story-3,ttsquared77,10,Just casually crying throughout
toy-story-2,ttsquared77,10,Just casually crying during “when somebody loved me”
