movie_id,user_id,rating_val,review_text
malice,matth,8,"One the most ridiculous movies of all time, taken 100% seriously by everyone involved (Gordon Willis giving this his trademark prince of darkness look lmao) except for Alec Baldwin who plays it with the perfect mischievous twinkle in his eye that proves he is simply the greatest actor to ever live."
talk-radio,matth,6,Awesome Alec Baldwin performance. They should have used clips from this for flashbacks on 30 Rock.
never-too-young-to-die,matth,2,Further proof Kiss sucks!
sid-and-nancy,matth,6,Opens with a disgusting scene of people eating beans
the-irishman-2019,matth,10,😿
operation-kid-brother,matth,2,Letterboxd glitching out. This should be rated 5 stars. If mods can read this please fix the glitch.
the-peacemaker,matth,6,handsomely made sturdy workman like
conclave,matth,8,Tinker Tailor Soldier… POPE???
for-yur-height-only,matth,10,What he lacks in height he makes up in THRILLS! Weng Weng IS Agent Double O.
the-changeling,matth,9,"Very nicely fits into the Ross Macdonald west coast sins of the past mystery formula, just making the ghosts literal. Crazy George C Scott never played any of the famous PIs."
planes-trains-and-automobiles,zackpaslay,,"Be nice to customer service employees, kids! Especially during the holidays!"
wings,zackpaslay,,Incredibly tender performance from Charles “Buddy” Rogers (who I fell in love with the second he appeared onscreen). That final scene between Jack and David… WOW. It’s insane what technical feats are pulled off in this film.
gladiator-2000,zackpaslay,,"Solid entry in the Movies for Dads Canon. Accidentally dozed off a little during The Spaniard’s ascent, but woke back up when Maximus and Commodus were reunited, and the rest of the film really kept my attention. Really loved watching Commodus lose his mind over how Maximus could only be beloved. The monologue about virtue near the beginning is both heartbreaking and the most “Jeez, this guy is pathetic” shit I’ve seen in awhile."
birth-2004,zackpaslay,,"Haunted by this. A dissertation on the everlasting effects of grief - the hope that never completely dies and the hoops we jump through to justify said hope. Nicole, in her Mia Farrow cut, is haunted and haunting. Cameron Bright is a blank canvas, able to see through the viewer. That final scene in the bathroom is so difficult, uncomfortable and perplexing, leaving one distraught. Loved viewing this with the wonderful Chicago Film Society and going out for drinks with friends afterwards."
love-actually,zackpaslay,,being straight seems exhausting
mike-nichols-an-american-master,zackpaslay,,"a loving tribute to a brilliant artist, made with care and humor."
wicked-2024,zackpaslay,,"Let me get my gripes out first because I did genuinely enjoy this - the backlighting and cinematography generally do such a disservice to the beautiful sets, costumes, and performances. This could’ve been the best looking film of the year and it gets in its own way, and that’s disappointing. The edit could’ve used another pass as well.With that, I really liked it! Ariana is easily the standout, somehow both subtle and over-the-top, with excellent comedic timing. Cynthia is…"
all-that-heaven-allows,zackpaslay,,"“To thine own self be true. That’s Ron.”Oh what beauty there is in the simple declarations of love. What joy there is in abandoning that which doesn’t matter, so simple yet so difficult. The illumination of life, finding truth through blue light and carefully placed snow, letting a deer run into frame at the perfect moment. Falling and spinning, sinking into one another, all in glorious Technicolor. Romance has rarely been so encompassing."
thelma-2024,zackpaslay,,"A lot more reflective than I was expecting, really tapped into the horror of losing autonomy. Very funny in many sections as well. Squibb is incredible - really wonderful to watch as both a comedic and dramatic actress. Screamed at one very specific cameo."
a-real-pain,zackpaslay,,"Everything reminds me of her (the her in question is Old Joy, dir. Kelly Reichardt)! Great showcase for Kieran Culkin, who weaves the wirey thread of his character so masterfully. Eisenberg also gets a fantastic monologue in the middle of this. Loved seeing Jennifer Grey!"
the-heartbreak-kid-1972,zackpaslay,,"Charles Grodin is perfectly scummy, Cybil Shepard is perfectly charming in this sort-of meta role, and Jeannie Berlin is plain perfection - a comic force. Loved seeing this marvelous comedy alongside a full house today, and I’m glad I saved this for an opportunity like this. Thank you to Colton for sharing Miss May’s works with us!"
the-tune,zackpaslay,,Like if David Lynch held the Schoolhouse Rock songwriters and a children’s book illustrator hostage. Loved it! Playing next month at the Music Box Theatre!
fantasia,zackpaslay,,"Hi friends!! I am beyond thrilled to announce that I will be introducing this absolute triumph of music and animation when it plays (in 35mm!!!!!!) on Saturday, November 16th at 11:30am at the Music Box Theatre in Chicago. We’re planning some fun surprises and activities for both our midnight and matinee shows of Fantasia, so please buy your tickets and stay tuned to the Music Box’s socials!! 💙"
whats-opera-doc,zackpaslay,,also made my friends watch this perfect short as part of a preshow/trailer reel i made for my birthday screening hehe
the-long-day-closes,zackpaslay,,surrounded by good friends at the end of a lovely day. happy birthday to me. thank you terence for such a poetic film. now to sleep.
the-holdovers,zackpaslay,,"Feeling as though you’re off-putting, incapable of good, and completely lonely and still being able to find people who can see under the layers of armor… that’s the good shit. Through so many disappointments, there’s still hope and love to be found"
moonstruck,zackpaslay,,"beautiful and impulsive. everything is romantic, right?"
hangover-square,zackpaslay,,"Incredible ending. This thing just looms, anchored in obsession and confusion, completely oblivious to the outside world. That George scores his own demise is uniquely tragic, as his world burns - the world of his own unaware making. It's deeply sad that Laird Cregar passed two months before this was released, he delivers such a wonderful performance in this."
blitz-2024,zackpaslay,,"very handsomely-made film that's surprisingly restrained emotionally for McQueen. Saoirse is great, but overall, this didn't offer much that felt fresh to me. after so many twists and turns, amidst all of the bombs and the chaos, one hopes to feel something for the characters, but by the final shot, it rang a little hollow for me. McQueen is an excellent filmmaker, which makes this film's lack of affectivity that much more disappointing"
emilia-perez,zackpaslay,,"oh dear,"
the-ghost-ship,zackpaslay,,"the scene with the chain links... haunting!!!!!! loved the ending confrontation, illustrating the disconnect between the authority and the employee, the captain and his crew"
the-nutcracker-1993,zackpaslay,,"Was deeply curious about this given its year of release, budget, and being Emile Ardolino's final theatrically released film. At the end of the day, it's just a live-capture of the New York City Ballet's production of The Nutcracker (featuring Macauley Culkin because it's 1993), but that's not a completely bad thing. Culkin never seems fully comfortable amidst all of the pageantry, but the film does still deliver that pageantry in full force. Is it as exciting as watching the…"
its-the-great-pumpkin-charlie-brown,zackpaslay,,happy halloween! the great pumpkin is risen! 🧡
smile-2-2024,zackpaslay,,"No joke, Naomi Scott gives one of the best performances of the year in this. A viscerally upsetting and hopeless movie. Loved it!"
conclave,zackpaslay,,"Genuinely taken aback by how much I loved this. A chamber drama of a highly melodramatic caliber, with loud whispers, taboo, and political commentary loudly onscreen. It’s on-the-nose on purpose, just like Sirk liked it. Whole cast delivers, with enough walk-and-talks to make Sorkin say, “Hey, maybe I should write something interesting again.” Who knew the papacy could be so petty? Kinda makes me wanna watch America’s Next Top Model"
we-live-in-time,zackpaslay,,"Very charmed by Florence and Andrew in this. I appreciate the swing of doing a non-linear narrative, I just don’t know that it completely works for me here. Gas station scene was excellent! I really wish I felt more emotionally invested in the characters, though again, the two actors are doing very well with the material. Not a bad film in any capacity, I just wish I’d felt more compelled by it."
the-seventh-victim,zackpaslay,,"dread has rarely been so palpable. the hallways, the stares, the cries, the refusal of the obvious. everything lives in shadow."
anora,zackpaslay,,"I remember at one point during press for The Florida Project, Sean Baker said something along the lines of “I’ll probably never have a budget over $1mil, I wouldn’t know what to do with it.” Cut to seven years later, Baker’s Anora utilizes his unique sensibilities in terms of character and humor (this might be the closest thing to a screwball comedy I’ve seen in years) while expanding the scope in terms of location, movement, and image. Mikey Madison is unstoppable, clinging to Anora’s perseverance and headstrong nature for dear life, maintained by Baker’s absolute desire for authenticity. Loved it!"
over-the-garden-wall-2014,zackpaslay,,"Rewatched in preparation for our special members screening of this at the Music Box on November 6th! Such a lovely send-up of early animation and the ordeal that is being a teenager in touch with his feelings. Also, Greg is the best!! And that’s a rock fact!"
dumplings,zackpaslay,,"every time Bai Ling walked in wearing a new pair of print capris, i cheered"
fiesta,zackpaslay,,"Ricardo Montalban gives a fantastic debut performance here. The film itself is fine, but Montalban dances, fights, and charms with gusto, bursting into the film with the vitality of a new star commanding the screen. His two dances with Cyd Charisse are an absolute knockout!"
vox-lux,zackpaslay,,"Fame and violence in the 21st century. Completely understandable that this would be divisive, but I found it to be such a rich dissection of America’s obsession with spectacle and celebrity in a post-9/11 world. Celeste’s descent into lacking personhood or self-awareness rings true knowing that she survived the opening tragedy as well as the tragedies of being a woman in the public eye in the mid-00s. Does it make her good? No, but it explains her actions.I know Natalie Portman kills “Can’t Get You Out of My Head” when she goes to karaoke."
damn-yankees,zackpaslay,,Gwen Verdon!!!!!!!!!!
same-old-lang-syne,zackpaslay,,"It’s been almost two years since we shot this little film. It’s crazy to think about everything that’s happened in those two years, especially considering how much more at peace I am now than I was then. I was so sad in the periods around when this was made. I was so lost and terrified and completely unable to feel at-home in my own life. Being on set making this was one of the few moments of solace I felt…"
saturday-night-2024,zackpaslay,,some great moments mixed with some baffling choices. the jim henson characterization??? not how i would’ve approached that! thought most of the cast was great tho! first 20 minutes and all of its whip pans made me slightly nauseated. weird to see a movie be like “Saturday Night Live was anti-establishment and revolutionary” when it’s been The Establishment for most (if not all) of my life. dylan o’brien hot.
lady-in-the-water,zackpaslay,,"Drifted in and out of this during our late late showing - the dreamlike state of this movie honestly lends itself to it. Felt very compelled by how community-centric the whole film feels. Story almost acts as Dorothy, lost in a foreign world looking to go home, and the apartment complex acts as the Scarecrow, Tin Man, Lion, Wizard, and Ozians all rolled into one. idk I’m very sleepy and I felt Shyamalan’s wonder seep through as I was drifting in and out and I liked it!"
evil-dead-ii,zackpaslay,,Oops! All Chaos!!
office-space,zackpaslay,,"Cute! I could never work in a corporate office, y’all stay easy tho. I sometimes fear I’ll be seen by others like Brian the Overexcited Chotchkie’s Server, but he seems like he would be a scab, and I would never do that!!!!!"
megalopolis-2024,zackpaslay,,"Look, it held my attention, and it’s incredibly ambitious, and it’s nice to see something about the future that, in the end, rebukes dystopia. It’s incoherent at times, sure, but idk I was taken with it - excess in its purest state. At one point, Adam Driver looks like Rihanna in the “Disturbia” video. Aubrey Plaza is genuinely excellent, and I just think Kathryn Hunter should be in everything."
the-wild-robot,zackpaslay,,"Really, really lovely. Lupita (unsurprisingly) gives my favorite voice performance of the year so far. The compositions in this are insanely good, with some really fun camera movements and use of perspective. It’s lovely to see Chris Sanders cooking like this again, really leaning into themes of community care and found family (which he’s great at)! Would love to see this really take off with the family audience!"
a-different-man,zackpaslay,,"Sebastian Stan does good work here, but the film really comes alive once Adam Pearson enters (which is probably the point). Really fun to watch Sebastian unravel as Pearson just keeps having more and more fun, really leaning into the self-hatred and unrelenting jealousy that Edward/Guy feels."
frank-capra-mr-america,zackpaslay,,"Fairly standard doc with a nuanced, mostly appreciative look at Capra that ties his career to the flaws of The American Dream. Dives into some of the cognitive dissonance of his films and his personal political beliefs as well as the problematic nature of the “self-made man” narrative he spinned about himself. Loved seeing Farran Smith Nehme and Sam Wasson as talking heads! They spelled Farran’s name wrong when they first flashed her name though! Shameful!"
lilies,zackpaslay,,"Masterful play-to-film adaptation, rich with its world-building and its oscillation between the real world and the theatrical. Can't even begin to dive into how powerful the performances are here - yearning, tragedy, naivety, romance, hope, mourning. The whole cast is fantastic, especially Danny Gilmore and Alexander Chapman. Truly wonderful film, a diamond in the Queer canon."
invasion-of-the-body-snatchers,zackpaslay,,"The moment he realizes that he's been hearing a radio from afar instead of actual human singing... heartbreaking! There's an underlying dread to this whole film that just rules, really emphasizing the horror of everyone around you turning cold and unfeeling. It's easy to see how many films were influenced by this - mob mentality, alien conquest, the whole nine yards. Kevin McCarthy has a great face!"
brute-force,zackpaslay,,Prime “I don’t smoke but I need a cigarette after watching that” cinema. The prison system has always been bad! Power corrupts! Burt Lancaster is hot!
hot-shots,zackpaslay,,"Very silly! Laughed many times with two long-time friends! There’s a moment where a lounge singer lays on an open piano and it closes while she’s laying on it, and if I saw that at a drag show/cabaret act/etc., I would throw all of the cash in my wallet at the performer"
an-american-in-paris,zackpaslay,,maybe Gene’s best choreography? a lot more charmed by this than i was as a teenager. insane that this is a best picture winner
the-texas-chain-saw-massacre,zackpaslay,,It’s very American
25th-hour,zackpaslay,,"Spike captures the grief, anger, betrayal, sorrow, and the pursuit of normalcy one takes after a striking blow. How quick will you be to blame someone else before you realize how much you are to blame? The five actors at the center are all magnificent, with Spike giving room for both bombast and subtlety. Insanely good ending."
magnolia,zackpaslay,,"PTA’s Short Cuts - truly magnificent in its scope and boldness. Those monologues, jeez. We need to get Tom Cruise back in contact with cool directors."
the-substance,zackpaslay,,This review may contain spoilers. I can handle the truth.  i liked it!! i think demi moore could take the makeup from her final solo transformation and go on Jackass!
little-shop-of-horrors,zackpaslay,,🎶HAVE JUST WITNEEEEEEEEESED🎶
they-came-together,zackpaslay,,Shot like an SNL digital short with parody humor that is both extremely obvious but also committed to the bit. I had a great time! Happy Birthday Michael!
the-last-unicorn,zackpaslay,,the score in this is unexpectedly fantastic
the-secret-of-nimh,zackpaslay,,"could’ve used another ten or so minutes at least, but jeez this thing absolutely rips. top-tier animation and design, compelling narrative, great voice acting! Brisby is an excellent movie mom! thought the disembodied woman singing was the same woman who’s heard in Snoopy, Come Home and The Rescuers, but it is not - correct vibe tho! Tubi forgot to play commercials for me on this one, thanks Tubi!"
vertigo,zackpaslay,,"Obviously, it’s great. Print looks and sounds beautiful. How many hours do we think Hitchcock would’ve logged playing The Sims??"
child-star,zackpaslay,,"pretty typical television doc, but compelling nevertheless. Jojo Siwa, put Snapchat away!!!!!!!! You don't have to do all that!! jarring to see the stuff about child YouTubers. reminded me of a lot of the parents I would see when I worked at Walt Disney World. would love to see parents be Normal about their creative and/or extroverted children! ironic that this is playing on Hulu, which is owned by Disney"
will-harper,zackpaslay,,the most i’ve ever laughed during something with will ferrell in a leading capacity. incredibly charming and lovely. i loved it!
that-night-in-rio,zackpaslay,,"Splashy, colorful, and silly! Don Ameche is charming as hell, Alice Faye is gorgeous, and Carmen Miranda is an absolute knock-out. I wish there was more Miranda, as she easily provides the most exciting moments in the movie, but the whole film is cute enough"
between-the-temples,zackpaslay,,“Do you have a VCR?”“Yes! Who doesn’t love a VCR?!”One of the best of the year so far. Schwartzman and Kane are both just completely electric. The edit (mixed with some great zooms) is perfectly disorienting at times and wonderfully serene at others. Great 16mm photography. There’s a perfect two-scene combo in this (“when I turned 13” -> eating the burger). Dolly de Leon is also a perfect foil to Schwartzman. Sooooo much to love!
the-outsiders,zackpaslay,,"“Do I care if I survive this, bury the dead where they're found/In a veil of great surprises, hold to my head till I drown/Should I tear my eyes out now, before I see too much?”"
seven-brides-for-seven-brothers,zackpaslay,,"there’s a lot of absurd things that happen during the runtime of seven brides for seven brothers, but besties, why were we laughing during “lonesome polecat”??? have we never felt heartbreak?? have we never felt loneliness and uninvited solitude?? have we never had to carry out our day-to-day while our minds were on another planet, hyperfixated on what could’ve been?? have we no respect for emotion over reason??? “lonesome polecat” is excellent, be quiet!!I was recently talking with a…"
show-people,zackpaslay,,"Very cute! Marion Davies plays at times like a Lucille Ball blueprint, and William Haines is both a great gay best friend and a solid love interest. A Star is Born for the matinee crowd!"
his-three-daughters,zackpaslay,,"Made me reflect on who I've been as a son and a brother, on how much I've stepped away from my family for various reasons without much explanation. Made me remember my grandmother, who I saw briefly a week before she passed, whose state of being rapidly deteriorated in the week that followed. Made me think about my parents, who've tried their best with me for the last nearly 30 years, whose son was the first on either side of…"
matilda,zackpaslay,,"Realized recently that I'd never seen this start-to-finish. It's lovely!! Devito is clearly inspired by Terry Gilliam here, which is very fun for a family flick. Lots of wide angles and camera whips and absurdity. I looooooove that beautiful house that the Wormwoods live in. Rhea Perlman is giving ""Audrey from Little Shop if she was evil,"" and I love that for me specifically. The ""Itty Bitty Pretty One"" sequence is sooooo cool. Kids rule!"
american-movie,zackpaslay,,top-tier sidekick in this one
trap-2024,zackpaslay,,average trip to walt disney world
zero-patience,zackpaslay,,"Bold, audacious storytelling with a clear vision. A bit inconsistent at times, but I have massive respect for how Greyson approaches both the satire and the central emotions of this - especially given the time in which it was made and how targeted Gaëtan Dugan and Queer people as a whole had become. AND it’s an independent film with humorous musical numbers where the songs aren’t awful. LOVE that!"
a-letter-to-three-wives,zackpaslay,,"love the structure, love the wit, love the fashions and interiors, love Thelma Ritter stealing scenes"
powwow-highway,zackpaslay,,"“Often the problems never change. Nor the people.”Gary Farmer gives such a joyful, layered performance here. The whole film is so in-tune with the land and its history, showcasing the beauties, humors, and tragedies. The scene where Philbert tells the story of Wihio and the plums is a knock-out, with Buddy’s cynicism and Philbert’s hope coming to a head, softly and quietly. So many great landscape shots in this too. Really hoping we see a restoration before too long - this film deserves it!"
merchant-ivory,zackpaslay,,"Very clearly appreciative of Merchant-Ivory’s productions and moxie, but also more-than-a-bit gossipy in nature. Solid but flawed retrospective. It did make me wanna watch the entire Merchant-Ivory filmography tho!"
bon-voyage-charlie-brown-and-dont-come-back,zackpaslay,,this was the shortest one and it felt soooo long and dragged out and very easily could’ve been a special instead of a feature but snoopy is still cute!
new-york-new-york,zackpaslay,,"A beautiful mess. Liza channels her mother with ease, and it’s so touching to watch"
mary-poppins,zackpaslay,,"Happy 60th Birthday to this beacon of creativity, warmth, and joy! ☂️"
big-trouble-in-little-china,zackpaslay,,how many video games did this inspire? how many theme park rides??
the-rider,zackpaslay,,"Breathtaking cinematography with a devastating central performance. Feeling like you have to prove yourself amidst the unfairness of life’s parade. Zhao directs the shit out of this, pulling truly remarkable work out of the actors, the settings, her crew, and the culture. The scene in the supermarket and the scene with Apollo in the field… really heartbreaking stuff."
the-holly-and-the-ivy,zackpaslay,,"Oooooooh I love holiday melancholy. Nothing like the entire family being in the same room to make long-held reservations come to the surface. Not animalistic like many ""family in one house"" movies, but rather reserved, anxious, and mournful. Margaret Leighton is marvelous!"
unbreakable,zackpaslay,,"The text at the end feels like a post-test screening addition to me, and I don't really care for it, but the ending itself? Fantastic. The use of color and lighting in this is magnificent, and Shyamalan has such a grasp on his characters and the unremarkable and fantastic world they inhabit. The compositions and the long takes are perfection as well - that first conversation on the train with David and the sports agent is so neat, like eavesdropping on people whose lives are complex, though we'll only ever know so much. Great take on the superhero origin story!"
rock-around-the-clock,zackpaslay,,"Men used to do full choreographed dance routines without a single hint of irony, bring it back!! I don’t know that this was ever going to be an amazing film, but I do wish a different director had been attached to it - some of the sequences are waaay too stiff and/or unsure of themselves. Lots of great choreography tho! Fun songs! Very silly to think of teenagers losing their absolute minds over some guy who looks like he’d play tabletop games with my dad. Cold War remains the film to best utilize “Rock Around the Clock”."
zu-warriors-from-the-magic-mountain,zackpaslay,,"i can admit that i lost the plot at some point, but i had TONS of fun! loved all of the composite effect work! loved the stunts! loved the cute men!"
cuckoo-2024,zackpaslay,,Would love to see Hunter Schafer and Dan Stevens do a comedy
funny-pages,zackpaslay,,"“Produced by Josh and Benny Safdie”me, starting to unclench for the first time in at least 40 minutes: what, really? who would’ve guessed???"
dogfight,zackpaslay,,"The way Rose completely disarms Eddie is so captivating. The way he slowly becomes gentler, aware that his own machismo is all bullshit. In any other movie, the scene where Eddie starts all of the machines in the music room would be unsettling, but here, it’s warm and open, signifying a change in himself - still a little brash, but melodic at the core. Lily and River pair magnificently!"
donnie-darko,zackpaslay,,Aero Theatre mentioned!!!!!!!!!!! Really dug this - can see why it would strike a chord at the time. The “Head Over Heels” needle drop was totally unexpected but I liked it! Really wanna know how Richard Kelly pitched this to Drew Barrymore
a-room-in-town-1982,zackpaslay,,"Cherbourg’s chain-smoking older brother. Wish Legrand had done the music here, but it’s pretty solid melodrama overall!"
all-that-jazz,zackpaslay,,✨pretty pictures✨
