movie_id,user_id,rating_val,review_text
kill-2023-1,bedtimebonzob,7,"Found this rough going at first thanks to dull leads and some sloppy filmmaking. Picks up considerably at the 45 minute mark with a genuinely surprising death and a late title card drop. From then on, it's near non stop close-quarters carnage, all of it inventive and well choreographed. It has some other interesting touches too, such as a main villain who's both a scary sociopath and an almost lovable fuckup, and a group of bad guys are who all…"
cuckoo-2024,bedtimebonzob,9,"This has a shockingly low letterboxd average, I suspect as a result of too many normies seeing it. This one’s for the freaks, and it rips. My favorite horror since WHEN EVIL LURKS."
silverado,bedtimebonzob,8,"Kinda not really about anything other than the idea of doing a Western as a big 80s adventure flick, but so well crafted, so stacked with charming character actors, and so much fun."
running-out-of-time,bedtimebonzob,8,"Johnnie To in hired gun mode, making a slick, commercial, high-concept crime film, but To being To, he infuses that genre template with so much wit and romance and longing that it puts most similar films of its kind to shame."
cora-bora,bedtimebonzob,7,"Pretty charming indie dramedy with a winning star turn from the great Megan Statler, and lots of fun LA alt comedy types filling out the margins. Eventually takes a dark turn that feels a little too heavy for the movie that surrounds it, but does go some way to explaining the character dynamics the film has set up."
doa-dead-or-alive,bedtimebonzob,6,"Cheapo video game adaptation full of very early 2000s extreme-sports meets-Maxim-magazine aesthetics has a garbage script and near universally awful performances (Jamie Pressly innocent... Eric Roberts NOT innocent), and yet is mostly a piece of trashy fun thanks to the late, great Cory Yuen's fantastic fight choreography and witty visuals. Not quite at the quality level of Yuen's equally silly SO CLOSE, but not that far away either! RIP to a great one."
twilight-of-the-warriors-walled-in,bedtimebonzob,8,"An impeccably designed love letter/elegy to a Hong Kong and a mode of Hong Kong cinema that doesn't exist anymore. Fantastic comic book style action, jaw-dropping sets, and fun characters. Takes some swings that won't be for everyone, and has a dull, flashback heavy second act, but still prob my fave pure action movie since RRR. Great use of HK legends Louis Koo and Sammo Hung as well."
what-time-is-it-there,bedtimebonzob,9,"Perhaps the funniest and prettiest Tsai I've seen, while still full of longing and despair. Seeing three Tsai films in a week really helped me feel out his rhythms. Loved this."
the-wayward-cloud,bedtimebonzob,8,"Tsai at his most original, merging his usual obsession with lonely people in dank urban landscapes with... sort of a slapstick, erotic musical comedy? Unforgettable."
i-dont-want-to-sleep-alone,bedtimebonzob,8,Tsai is the poet of flooding cities. Incredible final shot.
limbo-2021,bedtimebonzob,9,"Hong Kong neo-noir serial killer thriller in the vein of SEVEN or MEMORIES OF MURDER, with wildly dense, gorgeous b&w digital imagery and incredible trash-strewn production design that feels like something out of TETSUO: THE IRON MAN. Plot is engaging and well-paced if somewhat boilerplate, but the chases and fights are brutal and thrilling."
great-absence,bedtimebonzob,8,"Beautifully made Japanese dementia drama, structured like a mystery. Lived in, layered, and full of complex characters."
willy-wonka-the-chocolate-factory,bedtimebonzob,9,"Never seen this one, and for some reason thought it might be one of those movies you had to see as a kid to feel passionate about, but no, it's genuinely great, dark and funny and beautifully designed, with perhaps Wilder's best ever performance in the lead. Only real debit are the drippy songs."
the-transporter,bedtimebonzob,7,"One of the best, if not THE best, Besson written/produced Eurotrash B-movie, mostly because those movies are all ripping off Hong Kong guys, but this is the only that one went straight to the source and got the great Corey Yuen to direct (yes, technically it's a collaboration with the not great Louis Leterrier, but since I've also seen the truly awful Leterrier solo joint TRANSPORTER 2, I'm giving Yuen the credit for this one).The other major strength here…"
so-close,bedtimebonzob,7,"YES MADAM's Corey Yuen directs a female led techno thriller with some of the most aggressively ""made in 2002"" aesthetics of all-time. If you can stomach that stuff and a lot of bad CGI glass, this is kind of a blast, a twisty, fast-paced, and ultra stylized ride that never lets up."
the-big-heat-1988,bedtimebonzob,7,"To's first crime film weds a somewhat generic story to tons of fantastic action and enviable cinematic style, along with more body-mutilating gore than a horror movie. My favorite To's are the weirder, more poetic ones, but as a straight-ahead genre thrills delivery machine, this more than satisfies."
running-on-karma,bedtimebonzob,8,"Perhaps To's most wildly original film, which is saying something. What a mix of tones and ideas, so full of life and energy and then, in the film's poetic final act, so extremely moving."
abigail-2024,bedtimebonzob,7,"Very fun horror thriller with a killer cast -- Stevens and Newton are the adult standouts, but the movie wouldn't work without Weir, and she totally nails the tricky role. I agree with the critique that it takes way too long to get to its reveal, when said reveal is shown in all the marketing, but it's still entertaining both before and after that moment, so it didn't bother me too much. Nicely shot by excellent DP Aaron Morton too,…"
millennium-mambo,bedtimebonzob,9,"Third time viewing but first time in theaters, still really just a marvel. A claustrophobic, bleary-eyed portrait of the cycles in a toxic relationship, gorgeously shot and anchored by an all-timer Shu Qi performance. The few times where we leave the windowless worlds of apartments, clubs, and hostess bars are each breathtaking -- from the incredible opening shot to the wonderfully romantic images of snowy northern Japan. Really need to see more Hou Hsiao-hsien."
the-wrong-trousers,bedtimebonzob,10,"Rewatched to show it to my wife, who'd never seen! Still my favorite W&G short. Basically perfect. Final chase is an all-timer."
boy-kills-world,bedtimebonzob,5,"Not great, but gets better as it goes -- I'd say the second half features some of the better American studio action scenes since at least the last John Wick. Rothe is fun too, and Bill Skarsgard makes a surprisingly credible action hero. But the dystopian world is thin and poorly imagined, and the humor consistently grating."
city-hunter,bedtimebonzob,5,"Hong Kong trash merchant Wong Jing adapts the popular manga series as a Jackie Chan riff on UNDER SIEGE. The whole thing is tasteless and staged like a live-action cartoon, but there are some fun gags, solid production value, and some of the usual fantastic fights and stuntwork, even if it's far more Wong's film than Jackie's."
sparrow,bedtimebonzob,9,"Blissful crime caper from Johnnie To. Effervescent, wildly enjoyable, and filled with masterful setpieces. Like Lubitsch or Jacques Demy went to Hong Kong. Loved."
a-quiet-place-day-one,bedtimebonzob,8,"Maybe my favorite QUIET PLACE? And I'm a big fan of the other two. But man, Sarnoski did an incredible job infusing this with big emotion while using very little dialogue. Lead perfs are both incredibly good. Also, what an ending!"
new-police-story,bedtimebonzob,6,"Enjoyed Jackie in serious mode in CRIME STORY more than I thought I would, so I gave another ""serious"" Jackie movie a try, with this, an early 2000s entry in his legendary POLICE STORY series. Unfortunately, this one is closer to what I was expecting from a Chan drama, with long lulls between action and Jackie overacting wildly trying to prove his dramatic bonafides. Fortunately, the action that is there still rips, with a runaway bus chase at the midpoint…"
didi-2024,bedtimebonzob,8,"Belongs up there among the recent coming-of-age high points like Pen15, EIGHTH GRADE, and LADY BIRD thanks to its raw authenticity, complex characters, and excellent performances across the board. Loved the well-observed period details (even if the ""period"" keeps getting closer to now... this movie is set in 2008!), and the soundtrack, and one thing this one has that those other recent coming-of-age films don't is a male protagonist, and as such this feels especially sharp in its observations of…"
kinds-of-kindness,bedtimebonzob,8,"Loved POOR THINGS and liked THE FAVOURITE, but still very happy to see Yorgos back in full freak mode with his old Greek co-writer (also happy to see him mostly ditch the fisheye lens stuff for this one).Anyway, let's give thanks for a strange, dark, and original three-hour comedy! Kind of gives me a hope that a filmmaker this particular and uncompromising has found an audience."
hello-dolly,bedtimebonzob,9,"Can def see how this lavish, old-school musical flopped in '69, but viewed today it's just a reminder of everything we've lost. Production value! Movie stars! Colors! 70mm archival print looked incredible."
dead-or-alive,bedtimebonzob,6,"The incredible, hyperkinetic opening five minutes of this might be Miike's masterpiece, and the ending must be seen to be believed, but unfortunately the stuff in the middle, despite gorgeous location work and lots of eccentric details, is a mostly dull cops and robbers stuff."
crime-story,bedtimebonzob,7,Jackie Chan gets serious in this generic but very well-crafted actioner with some brutal and highly inventive setpieces.
motorway,bedtimebonzob,8,"Lean and mean, like the opening scene of DRIVE if it were a 90-minute Hong Kong banger. Gorgeously directed."
under-paris,bedtimebonzob,5,"After a great prologue, becomes decidedly dull, never making us care for its flat characters. Also, takes forever for the sharks to actually, you know, attack. Bonus points for a fun, explosive finale (even if it's too little too late), and a ballsy final beat."
gaslight-1944,bedtimebonzob,9,"Watched this in the same theater it played in LA on its initial run eighty years ago! Fantastically atmospheric psychological thriller with incredible performances, especially Bergman's."
ju-dou,bedtimebonzob,8,"An absolute visual feast of a melodrama, with an amazing Gong Li performance at its center. Not quite up there with Zhang's masterpieces, but great."
hit-man-2023,bedtimebonzob,7,"Charming, even if I wanted to like it more. Funny, smart, and sexy, with two genuine movie star performances by the leads, but I wanted it be be snappier, more stylish, and a little bit more willing to examine the darkness around its edges (I also suspect, like most movies, this would have played better for me in theaters than at home on Netflix, but I'm unemployed so it is what it is).Bonus points for what I think are not one but two clips taken from the great Nikkatsu noir A COLT IS MY PASSPORT."
love-lies-bleeding-2024,bedtimebonzob,8,"My 5000th movie watched! Fortunately, I really dug it, a gloriously stylized and sensual neo-noir with fantastic performances. Script is a little thin and it all gets a tad silly towards the end (though I loved THAT moment), but overall a great time. Glass is a talent."
immaculate-2024,bedtimebonzob,6,"This review may contain spoilers. I can handle the truth.   A nice-looking dud for its first hour thanks to a very weak, thin script with little depth or surprises and nothing to say, that is thankfully somewhat redeemed by a gleefully unrestrained final twenty minutes where it finally goes full exploitation, and Sweeney is allowed to really let loose.Did myself no favors by seeing this after THE FIRST OMEN, which is functionally the same movie for much of its running time, but does pretty much everything better (and yes…"
duel-to-the-death,bedtimebonzob,8,"Dark and nihilistic wuxia centering around the titular duel between a Chinese and Japanese warrior, which is then complicated by all sorts of conspiratorial plots, the best of which involve a gang of delightfully surreal ninjas. Shot and edited beautifully, with incredible swordplay throughout."
furiosa-a-mad-max-saga,bedtimebonzob,8,"Cool how FURY ROAD homages a moment from SEVEN SAMURAI, and then this one homages a moment from YOJIMBO. This is nearly great, and I appreciate that it's very much its own thing and not just an attempt to recapture the lightning in a bottle of FURY ROAD. The parts that feel like a Leone revenge epic are fantastic, gritty and bloody and poetic, with wonderful performances from Taylor-Joy and a never better Hemsworth, and standout new characters who feel…"
amadeus,bedtimebonzob,10,"Haven't seen this since I was like 15, so the premiere of the new 4K restoration at the incredible David Geffen Theater in the Academy Museum was a revelation. Feels like the last gasp of New Hollywood filmmaking, which makes its thematic concerns all the more poignant. Also, a major precursor to THE SOCIAL NETWORK, and the kind of movie that won eight Oscars including Best Picture and still feels like it maybe should have won more? Basically perfect."
mad-max-fury-road,bedtimebonzob,10,"Finally checked out the ""black and chrome"" version to prep before finally seeing FURIOSA this weekend. Prefer the color version, though both are worth checking out. Honestly, FURY ROAD would look great in any color. It's FURY ROAD. It's perfect."
symbiopsychotaxiplasm-take-one,bedtimebonzob,9,"Brilliant, way ahead of its time meta-filmmaking doc."
top-secret,bedtimebonzob,7,"Funny spoof filled with great visual gags and led ably by a very game Kilmer, but not quite successful enough to turn me into one of those people who think this is better than AIRPLANE! or THE NAKED GUN."
the-equalizer-3,bedtimebonzob,6,"Slick, generic action sequel gets by on Denzel's star wattage and gorgeous Italian locations, even if it loses points for dull villains and a paucity of action -- perhaps on the latter issue, they were writing around Washington's age?"
i-saw-the-tv-glow,bedtimebonzob,9,"Feels like a major work, a deepening of all the interesting elements in Schoenbrun's debut, packed with indelible imagery. And while we've denigrated the term by applying it to anything vaguely surreal, this is truly the most Lynchian thing I've seen in forever.Plus, I knew Buffy was an influence, but was not expecting it be such a massive one. This former Buffy obsessive identified hard."
arcadian,bedtimebonzob,6,"Mostly wastes the coolest creature design in years -- think a combo of the creatures from ATTACK THE BLOCK and THE THING with Kamaji from SPIRITED AWAY -- in a solid but generic post apocalyptic horror that riffs on A QUIET PLACE and The Walking Dead while not reaching the heights of either. Cage is great in the same haunted mode that's lead to some of his best late-period performances in stuff like JOE and PIG, but he's not in this one enough to elevate it like he could."
do-not-expect-too-much-from-the-end-of-the-world,bedtimebonzob,9,"Hilarious, biting satire, full of a jumpy New Wave energy and driven by a prankster's ethos, with one of my favorite lead characters/performances in quite a while. Ends in incredible single-take setpiece that one-ups the finale of Jude's previous BAD LUCK BANGING OR LOONY PORN. Loved this."
great-choice,bedtimebonzob,7,"Carrie Coon is trapped in a Red Lobster commercial in this very ADULT SWIM-coded surreal horror short. Well made and doesn't overstay its welcome, even if the attempt at a clever final twist didn't do much for me."
the-last-stop-in-yuma-county,bedtimebonzob,7,"Fun single-location crime thriller in the Tarantino/Coens/Elmore Leonard mold. Doesn't break much new ground, despite a surprising turn at the bottom of act two, but is still plenty gripping throughout and a great calling card film for director/writer/editor Galluppi."
woman-of-fire,bedtimebonzob,8,"Kim's original THE HOUSEMAID is the better film (tighter, more psychologically compelling), but if anything this one feels even MORE influential on the next generation of Korean genre filmmakers, especially Bong Joon Ho, whose PARASITE takes a ton from this, and Park Chan Wook, whose baroque style and love of boundary pushing content can be seen throughout (this one also has a sketchy business operating out of the upper floor of an abandoned building, just like in Park's SYMPATHY FOR…"
faith-2023,bedtimebonzob,7,"Yet another shot-on-a-phone promo short! This is a very fun one that feels like Na's take on a comic book movie, except it's more the stylized '90s pulp antihero version in the vein of Darkman or The Crow, with a little Matrix and anime influence worked in. It's let down a bit by a weak punchline ending that doesn't land at all, but until that moment, cool as hell. I would be very down for a feature length action film from Na (I consider THE CHASER and THE YELLOW SEA primarily thrillers, though they do both contain killer action beats)."
minari,bedtimebonzob,10,"This was my favorite movie of 2020, but I never saw it in theaters because of... you know. So to see it again in 4K in what is to me the best theater in LA (the David Geffen theater at the Academy Museum) with the great and ever-charming Youn Yuh-Jung in person, was a real treat to say the least."
chime,bedtimebonzob,8,"Another perfectly unnerving horror film from Kurosawa, with incredible sound design and brilliant compositions throughout. Reminiscent of both CURE and PULSE, except this one gets the job done in a mere 45 minutes."
the-coffee-table,bedtimebonzob,8,"Bleak, bleak, BLEAK. But funny! Sort of like UNCUT GEMS meets SPEAK NO EVIL meets the dinner party ep of the US Office. By its very premise, this is only going to appeal to a niche audience, but it's well made and acted and the director displays an impressive command of tone -- too glib and you would check out immediately, too emotionally real and the pain of watching the tragic events unfold would be too much. It's a very fine line to walk, and Casas mostly nails it, though your mileage may, and I suspect will, vary wildly."
souvenir-2018,bedtimebonzob,8,Very charming short from the Thai filmmaker behind the great HAPPY OLD YEAR. Made me miss Tokyo like crazy.
bus-girl,bedtimebonzob,7,"Story is pretty generic and somewhat cheesy underdog-makes-good stuff, but the filmmaking is excellent throughout, especially for a directorial debut. Henwick needs to be a huge star already."
sleeping-beauty,bedtimebonzob,8,Embarrassing how much better looking this is than anything Disney animation has put out in the last twenty years.
how-to-have-sex,bedtimebonzob,7,"Dug the AFTERSUN/Andrea Arnold style of this, a sort of dreamy, hazy naturalism that's very much my taste. Fantastic performances, too. Feels a little undercooked narratively at times, like a short dragged to feature length. Still, good."
nothing-except-everything,bedtimebonzob,1,Every generation gets the GARDEN STATE it deserves.
one-armed-boxer,bedtimebonzob,8,"Goofy, exciting bit of martial arts pulp, filled with inventive fights against ultra colorful villains. A blast."
river-2023-1,bedtimebonzob,9,"Second viewing, still mega clever and charming. Filled with delightful setups and payoffs. Love this ensemble cast."
challengers,bedtimebonzob,9,That's a MOVIE right there.
irma-vep,bedtimebonzob,9,Just the coolest shit. Assayas makes it look effortless. Maggie Cheung forever.
the-roundup-punishment,bedtimebonzob,7,"These movies are formulaic and all pretty similar, but sometimes genre craftsmanship and Don Lee punching people is all you need. Fun. Preferred this slightly over the last entry I think — better villain and better final fight. Also, less xenophobia and police brutality than usual!"
infested-2023,bedtimebonzob,8,"REC meets ATTACK THE BLOCK meets LA HAINE in this stylish and witty French creature feature. Strong characters and a very likable lead, too. Loved the setpiece involving a hallway full of spiders and an overhead light on a timer."
full-moon-in-new-york,bedtimebonzob,7,"Melancholy slice-of-life about three very different immigrant women in '80s New York who become friends. Not every subplot fully engages, but the leads are magnetic and their scenes together a delight. Love the moody synth score and the controlled color palette of greys, blacks, whites, golds, and reds. As with the other films in Criterion Channel's Hong Kong in New York series, an incredible time capsule of the era."
late-night-with-the-devil,bedtimebonzob,7,"Creepy and quite clever, with a genuinely fantastic lead performance, but gives real ""we've got GHOSTWATCH at home"" vibes after a while. Also, fuck AI."
a-place-in-the-sun,bedtimebonzob,10,"Astounding noir melodrama, a gorgeous and tragic fever dream with two stunning movie stars at its center. I really need to see more Stevens because this one kinda blew me away."
tapeface,chandlerballi,,Soon
a-real-pain,chandlerballi,7,Jesse Eisenberg goat
beyond-hells-kitchen-making-daredevil,chandlerballi,,Great stuff
juror-2,chandlerballi,7,He’s 94 and still cooking like this!!! What!!! He was born in 1930!!! Nicholas Hoult goated
here-2024,chandlerballi,8,Like the opening scene from UP stretched to an hour 40. I have yet to watch a bad Zemeckis film. I feel like im walking through a minefield because of how people talk about some of his work. Loved this. Me and the 6 other old people in the screening were all crying.  “I love it here.”
venom-the-last-dance,chandlerballi,7,15 minute stretch in the middle of the film where is becomes one of my favorite movies of the yearIMAX
beau,chandlerballi,,Some great bits in here that I wish he put in the movie
smile-2-2024,chandlerballi,9,Wow. What a great time. Don’t think I’ve jumped this many times in a theater in the last decade. Great scares. Naomi Scott is incredible. Skye Riley’s songs are good. Nepo smile Jack Nicholson’s son is genius marketing. Felt like I was watching a new chandler classic. Going to try to catch this again before it leaves theaters.
joker-folie-a-deux,chandlerballi,10,Watched it the first time on Friday. Then shot some stuff for my new movie over the next two days. This is one of those that just stayed in my head and was hard to put down. Took my roommates to see it again last night. I think Ive decided im in love with this movie. An incredible deconstruction of the first film - and in a way comic book movies in general. I remember reading an interview with Todd…
joker-2019,chandlerballi,4,Looks good!
monty-python-and-the-holy-grail,sconesaregood,8,I hope that we are far enough removed from the time when this was the primary text for nerds who needed something to quote to try and be funny that we can all come back around and appreciate how funny it is every single time you see them pretending to ride horses
afternoon-clouds,sconesaregood,,Very strong Weerasethakul influence
watermelon-man,sconesaregood,8,"One of the funniest movies I've seen for a while, just non stop gags and jokes, definitely underrated as a post-golden age screwball. Also fun to hear where a few MF DOOM samples came from, I love whenever that happens."
delta-space-mission,sconesaregood,6,I love how casual the narration is. My favorite part was the big squishy green guys goofing off. Lots of fun visuals and synth sounds but also lots of scenes that go on way too long. Kind of feels like a sega Saturn game
lifeforce,sconesaregood,7,"This review may contain spoilers. I can handle the truth.   Insane mix of Horror tones here: Alien parasite, Hammer Horror, classic universal, Jean Rollin vampire films (this is a generous way of phrasing ""a lot of the movie is a vampire played by a french woman wandering around nude""), zombie apocalypse, it's all here folks. The Every performance in this is shooting for its own extremely strange tone, it's a lot at first to manage the swings in dialogue scenes and then Carlsen shows back up and as Loose Cannon…"
trapped,sconesaregood,5,"At points the whole counter fitting angle is neat but on the whole pretty weak noir,"
old-boyfriends,sconesaregood,7,"Didn't realize this was written by Paul Schrader going in, I am maybe a little overloaded on his sensibility at the moment but still enjoyed it. Minneapolis mentioned. Wow is it depressing to watch this, think ""I wonder what else Tewkesbury has directed, she as an interesting and unique sensibility here that shines through even though she's not the (credited) screenwriter,"" and to then see that list of director credits."
light-sleeper,sconesaregood,8,"One of Defoe's best performances, which is a high bar. I find the image of him hugging Jane Adams very comforting. Great work from Ed Lachman too, both the scenes with nice colored lights (something he's good at doing very strongly but without it being overdone to the point of being a distraction, unlike a lot of other films with ""neon lighting"") but also scenes where Defoe and his surroundings look muted and totally drained of life. People point out…"
one-from-the-heart,sconesaregood,7,"Ridiculously beautiful at literally every second, which is especially impressive because it's all on a sound stage at no point could they lean on things like ""the world's natural beauty"" or ""the light at magic hour.""* This is very good because at basically no point did I find myself even a little bit invested in the central relationship between Garr and Forrest, and only really casually interested in their respective affairs. *Not to knock naturalistic lighting or nature photography as…"
