movie_id,user_id,rating_val,review_text
edmond,ev1lcatboy,,i hate this fuck ass movie. no further thoughts
stream,ev1lcatboy,6,thanks jeff
the-garfield-movie,ev1lcatboy,,was not worth free pretzel bites. im just not the target audience
bad-cgi-gator,ev1lcatboy,2,1 star for the gator
monkey-man,ev1lcatboy,10,holy shit
what-the-do-we-know,ev1lcatboy,,found this at an antique store for 5 dollars. not worth it
shin-ultraman,ev1lcatboy,10,ultraman....save me......
onyx-the-fortuitous-and-the-talisman-of-souls,ev1lcatboy,6,"Holy crap. I don't think i actually *loved* this, but it was a fun time. A little too in-your-face about how self aware it is, with Onyx in particular, but all around a good time. Really Really Reallly good practical effects, fun stuff from Jeffrey Combs, great set design, etc. Song choices were great. I've watched a LOT worse for Jcombs. Probably would not watch again, but I will definitely look back on this fondly. Lot of love poured into this. Wish it was a little shorter"
uhf,ev1lcatboy,10,best movie ever made. nothing compares
puppet-master-vs-demonic-toys,ev1lcatboy,,i want to play with toys
five-nights-at-freddys,ev1lcatboy,3,"Holy shit. I really wanted to like this movie. Like really badly. I went into this with the mindset that if this was bad, I'd still enjoy it, and if it was good I would have a good FNAF movie. I can see the love from set designers and the animatronics puppetry and such.... but really nothing else. The story felt hollow and cheap, the pacing was seriously the worst I've seen in a while, and there was seemingly no tension. I could go on for a LONG time about how I feel about this, but mostly I'm just bummed."
get-out-2017,ev1lcatboy,10,Holy shit.
exhuma,dyketactics,7,sometimes it’s nice to watch something that doesn’t follow the american hollywood script structure ™️
being-john-malkovich,dyketactics,7,expected a lot more
the-merry-gentlemen,dyketactics,3,need this but it’s like a butch lesbian who came to fix the faucet instead
babes,dyketactics,6,enjoyable to watch but brought down by the millennial ™️ of it all
belly-of-a-glacier,dyketactics,,have not cried over a film in a while
a-short-film-about-killing,dyketactics,8,the only reference i didn’t get of jane schoenbrun’s last night while watching the tv glow commentary was the work of kieślowski. so here i am
time-cut,dyketactics,4,when u order 2003 from temureal talk the sister stuff got me 😢
i-saw-the-tv-glow,dyketactics,10,thank you delta airlines
gladiator-ii,dyketactics,6,ur telling me paul mescal showed up to ancient rome and didnt get a single hole rearranged ?
juno,dyketactics,10,i feel like diablo cody needs to make a resurgence but with gen z humor
close-to-you-2023,dyketactics,3,could have been a short
my-old-ass,dyketactics,5,boyfriend of bisexual girl phenotype fr
the-machine-girl,dyketactics,6,kinda bad but awesome gore effects
descent-into-darkness,dyketactics,6,what a lovely little euro trip
conclave,dyketactics,8,i’ve never been more gagged by a film
swarm-2023-1,dyketactics,9,me with julien baker
the-thing,dyketactics,8,went into the amc screen unseen tonight hoping it was nickel boys but it was some nazi movie 😭😭  almost was gonna ruin my night and then i saw another theater near me was showing the thing on 35 so we’re so back
the-bunny-game,dyketactics,1,not one to review bomb something for the hell of it but it was just so badaside from everything else egregious on top of it the score was so awful and distractingDNFFFFFF
dinner-in-america,dyketactics,8,autistic punk girl representation
profile-2018,dyketactics,4,i understand what this was getting at. but its wrong on so many levels.
heretic-2024,dyketactics,7,I SAW GOD IN THIS TACO BELL TONIGHT !!!!
the-sacrifice,dyketactics,7,it’s pretty good but i didn’t find it as thematically compelling as other films of his
red-white-royal-blue,dyketactics,7,im sorry but i eat shit up like this 😭😭 it’s so entertaining 😭😭
smile-2-2024,dyketactics,6,guys i think this might have been sponsored by voss?
fanatical-the-catfishing-of-tegan-and-sara,dyketactics,,really liked the exploration of queer female fan culture
we-live-in-time,dyketactics,5,she should have gotten with the they/them chef
american-mary,dyketactics,8,transgender surgeries on illegal aliens….
anora,dyketactics,8,lovedddddd these characters
twilight-2008,dyketactics,10,watching this directly after tv glow… isabel/tara and edward/bella are both having a trans and autistic off
will-harper,dyketactics,,watched with my family. dad asked what bottom surgery was.
the-cruise,dyketactics,8,sometimes i feel like the anti cruise is coming for me
v-h-s,dyketactics,3,"this is like my third time watching this movie, the first was in like 2012 and i still do not enjoy it. and i feel like im missing something based on how much the community enjoys it. good concept tho."
terrifier-3,dyketactics,6,i do not wanna hear about how this franchise hates women once more. just watch this movie
terrifier-2,dyketactics,7,your DAD drew that costume for you ??????
deadpool-wolverine,dyketactics,2,wasn’t gonna see this but i was bored tonight… i left 1.5 hours in and im surprised i made it that long… i just realized i would rather go home and read the plot on wikipedia
joker-folie-a-deux,dyketactics,4,not to be confused with fall out boy’s best album
red-rooms,dyketactics,8,guys she was just autistic :(
megalopolis-2024,dyketactics,2,2.5 hour watch ad
civil-war-2024,dyketactics,7,some of the sequences in this just scratch my brain in such a way… also the score is so so goodbut then so much of this is just bad
lisa-frankenstein,dyketactics,9,does universal know they made a movie with bottom surgery in it
tetsuo-the-iron-man,dyketactics,8,what a sweet little gay romance
beetlejuice-beetlejuice,dyketactics,6,soul train saved it
the-haunting-of-bly-manor,dyketactics,10,"“She was my anchor. And then, I suppose, she was my burden. She hung onto me, until she let go. And soon I'll let go too.""i can understand why it’s not for everyone but this taps into a lot of personal “horrors” for me. the horror isn’t a jump scare or a vengeful spirit, it’s about forgetting yourself and the people you love slowly. it’s about grief and the mutability of memory. as someone who has dementia running through…"
the-substance,dyketactics,5,audience was 99% full of film bros one of whom gave it a standing ovation at the end… that’s all i’m gonna say
la-chimera,dyketactics,9,oh you better not be haunting the narrative when i get there…
speak-no-evil-2024,dyketactics,5,blah blah masculinity blah blah nuclear family blah blah
robot-dreams,dyketactics,7,sending my therapy bill to the creators of this
hit-man-2023,dyketactics,5,"pretty enjoyable, and i didn’t predict a lot of the plot points which is my bar for netflix films. doesn’t feel like a linklater though."
the-thin-blue-line,dyketactics,,ACAB. i want that chocolate malt milkshake tho
fallen-leaves-2023,dyketactics,7,feels like a fassbinder film. if you wanna know how to light things in 2024 THIS IS IT!
tarot-2024,dyketactics,4,stop trying to make final destination happen! it’s NOT gonna happen!
milk-serial,dyketactics,5,low budget found footage available on youtube? sign me upultimately i had some problems with the pacing and editing. score was so distracting i would have preferred there was no score. sounded like the tik tok “creepy” video music.
the-passenger-2023,dyketactics,5,rip leopold and loeb you would have loved benson and randy
days-of-heaven,dyketactics,8,movie so beautiful i want to eat it
you-can-live-forever,dyketactics,8,it’s not a perfect movie but i like it :) something about it is so fall and comforting
the-deliverance-2024,dyketactics,2,"watched this on 1.25x while editing photos 🫶🫰this feels like it was made with about $20,000"
paris-texas,dyketactics,10,restoration so beautiful i was crying and shit
alien-romulus,dyketactics,8,close enough welcome back ellie williams
terrifier-2016,dyketactics,7,brat summer? i’m personally having a terrifier summer
blink-twice,dyketactics,6,NO ONE TOLD ME KYLE MACLACHLAN WAS IN THIS (POOKIE)
strange-darling,dyketactics,5,i blame promising young woman for this steaming pile of hot garbage
busted-babies,dyketactics,7,reminded me of a lot of random stuff so i’m just gonna make a list here:- trash humpers- this album cover- mrs. piggle wiggle: the radish cure (1994) - an episode of the pink opaque
coven-of-the-black-cube,dyketactics,9,i love goth lesbians
the-rocky-horror-picture-show,dyketactics,10,it was once in a lifetime to have susan sarandon introduce the screening and shadow cast tonight <3
the-crow-2024,dyketactics,1,its like if the after series was about andy biersack instead of harry styles. actually those movies are better.i literally walked out of the theater. i’m going to fuckint sleep
party-girl-1995,dyketactics,8,she’s just like me when i read camus for the first time
aliens,dyketactics,6,was taken out by the james cameron of it all… so boring and mid
mastermind-to-think-like-a-killer,dyketactics,,"maybe i’m biased because i worked on this show but this is a great little 3-part series about an incredible woman. everyone should hear her story. i found it really moving how she always stood up for the underdog, even at 87."
camp-rock,dyketactics,,how have i never realized this was shot on 35
wizards-of-waverly-place-the-movie,dyketactics,,i remember that wizard battle like it was yesterday
mid90s,dyketactics,6,so much of this is so so good. we need to bring back 16mm features fr 🙏🏻but a lot of the momentum is ruined for me by the decision to show a 28 year old actress in a sex scene with an 11 year old actor. i get that they wanted to portray rape/grooming but there is a way to show this without perpetuating it in your cast (pen15 does this well by using body doubles). also it was really uncomfortable to hear everyone in the theater laughing in reaction to the scene when emmy and i were trying not to throw up 😭😭
cuckoo-2024,dyketactics,6,save me masc hunter schafer…
bottoms,dyketactics,9,it’s already a classic
showgirls,dyketactics,10,had to catch a screening of this for my birthday
kamikaze-hearts,dyketactics,7,can’t believe it took me so long to watch this one. reminds me thematically a lot of the work of assayas.
it-ends-with-us,dyketactics,4,i know a free people hate to see lily bloom coming…
the-neighbour-before-the-house,dyketactics,,fantastic watch
heaven-adores-you,dyketactics,,q&a with jem cohen and nickolas rossihappy birthday elliott
lucky-three-an-elliott-smith-portrait,dyketactics,10,nice to see this not from a shitty youtube
trap-2024,dyketactics,6,obsessed with m. night’s dad era…his daughter ate as lady raven tho i cant liealso the only ad banner in the movie being for his other daughter’s movie the watchers
teen-beach-movie,dyketactics,,edited on imovie
hannah-montana-the-movie,dyketactics,,hannah montana is anti-gentrification
the-wicker-man,dyketactics,7,adult virgin… catholic… cop… fool… like pick a struggle
janet-planet,dyketactics,5,"god this was such a slog. i’m sorry. some of the worst projection i’ve seen from a theater ever. screen felt like i could have just stayed home and watched from my ipad.  there was no ac in the theater and i was fighting nausea the whole time. the cheeseburger i ate was nottttt sitting right. also about 30% of the theater was senile, asleep, snoring or all of the above. i connected with certain aspects of this but a…"
is-now-a-good-time,dyketactics,,not my sense of humor really
a-woman-like-eve,dyketactics,5,bring back lesbian communes
astrids-self-portrait,dyketactics,6,i want to know what rena would make if she had access to a big budget. not that this isn’t good but i see so much potential in her ideas and would love to see them executed on a larger scale. a lot of the “bad” filmmaking took me out of this one. and that gaudy 2010s coastal wine mom decor in the house. good god.
fly-me-to-the-moon-2024,dyketactics,4,uncanny valley ass movie… i’m convinced that they already have AI writing these scripts… and lighting these setsi feel like the sheer amount of incredibly bad screenplays i’ve had to witness this year have just taught me that i could write a movie because it’s not that hard to write something so incredibly mid. so many beats in this are bad or just plain unbelievable. upset the space nerd in me.
jug-face,dyketactics,7,really good for an indie horror with limited locations. i thought the characters were great.
safe-is-desire,dyketactics,,if the lesbian porn doesn’t have a montage of the main character drinking away their sorrows related to their past traumas while a kd lang-esque song plays in the background i don’t want it
suburban-dykes,dyketactics,,everyone cheered
mulholland-drive,dyketactics,10,thinking about how the first time i watched this movie was on zoom like 😭😭
showgirls-2-pennys-from-heaven,dyketactics,8,this was wild and probably the funniest thing i’ve seen in a while. showgirls does inland empire and the room.q&a with rena riffel after she is so cute i love her….
twisters,dyketactics,7,This review may contain spoilers. I can handle the truth.  girl… do not get with him that’s a trauma bond if i’ve ever seen one
national-anthem-2023,dyketactics,8,i want to circle back and write something longer but i’m just gonna say i really liked this….
oddity-2024,dyketactics,7,i walked into the theater for the 11pm showing and i was the only person there… kept hearing breathing tho. so maybe that environment is why i found this to be pretty creepy and scary. jump scares were used effectively after the right amount of tension. i also think i’m just more affected by ghosts. especially ones that don’t haunt out of a malice but ones that haunt because they are not at rest. there’s something so deeply sad about…
old-lesbians,dyketactics,,"“they’re going to find out i’m not like them but they can’t tell yet because i don’t look any different” this was incredible. to view this in the same room as about 100 lesbians of all ages was truly special. encapsulated many feelings i had myself, despite being born about 80 years after most of these women!! the inter-generational lesbian commonality is so beautiful to witness. and the stop motion animation was such a good touch that really sold it for me!!"
the-flesh-of-fallen-angels,dyketactics,,"was definitely expecting something different (more narrative). but this music video-esque, channel-switching vibe is cool. this feels like something i would see projected at market hotel and rave to (back when i used to go out and have fun and be cool)"
didi-2024,dyketactics,8,"screened at momi with sean wang q&asuch a cute, well-written, well-acted slice of life. takes itself just seriously enough.the filmmaker mentioned the 400 blows as a reference and i totally see the similarity in emotionality."
love-lies-bleeding-2024,dyketactics,10,have a feeling since i now own this movie it’s going to become like the first half hour of bound to me….
the-first-omen,dyketactics,8,eats down in so many ways….best horror of this year
longlegs,dyketactics,6,HE WAS A LOU REED STAN !!!!
the-jinx-the-life-and-deaths-of-robert-durst,dyketactics,,no relation to fred durst?
paper-towns,dyketactics,3,responsible for introducing a new generation to the manic pixie dream girl
lovely-dark-and-deep,dyketactics,6,i feel like a found footage movie in a national park by a park ranger could be cool 😎something like horror in the high desert
black-metal-veins,dyketactics,1,if lucifer valentine has 0 haters im dead
the-phantom-of-regular-size,dyketactics,,can’t help but sing this title in the tune of muna
the-reflecting-skin,dyketactics,8,beautiful production design and cinematography
the-last-exorcism,dyketactics,6,exorcism is just advanced gaslighting
zero-day,dyketactics,8,"i’m part of the post-columbine generation. for as long as i can remember, we were taught how to defend ourselves against school shooters, what to do and say to first responders, and participating in monthly drills. from a young age we were essentially traumatized under the guise of it being for our “protection.” so maybe it’s just because of the time i was born but i feel like people my age have become very desensitized surrounding school shootings. many of us did…"
body-double,dyketactics,10,i had to go to the movie theater to return the vhs tapes i rented from them and they were playing body double so i went to see it. coincidentally the movie patrick bateman is returning when he says he needs to return some video tapes. everything is meta.
bathroom-sluts,dyketactics,,leather jacket stays ON during sex
the-conspiracy,dyketactics,6,"i felt like they could have gone a lot further with the government conspiracy angle. theory seemed pretty surface level, but maybe i just expect more in the year 2024. i’m used to adam curtis level government conspiracy documentary."
inside-out-2-2024,dyketactics,6,lesbihonest
maxxxine,dyketactics,5,third act? never heard of a third act in my life. what’s that?
the-dirties,dyketactics,3,elephant is superior
damsel-2024,lanmar,4,". I didn't think I'd watch it but my sister encouraged me.  I think the film is very average, although it has some good elements like Millie Bobby Brown who does quite well (although I think she deserves better movies) and visual effects and music are also quite good. But the big minus is the too simple plot, almost everything is predictable, even despite these plot twists, although on the other hand it's an ordinary film produced by Netflix so what did I expect?"
maxxxine,lanmar,7,"I love this atmosphere of the 80s with horror and anxiety, I think this movie captured it all perfectly. Mia Goth is phenomenal as always, but I didn't expect anything else, she is a real star! The film itself is good, direction and roles of actors, nostalgia for horror movies from the 80s, topics related to Hollywood, soundtrack, although I have the impression that at some point the plot lacks a bit of coherence.But all in all, it's still a movie worth watching, and a worthy conclusion to the trilogy. By the way, I already know who I'll dress up as this halloween."
challengers,lanmar,6,". I have a problem with this film, everyone raves about it, but in my opinion it was so bland. The characters were very mean, so it was hard to root for anyone,the dialogues were often very embarrassing, I felt like I was watching a slow motion film all the time. Even though I like Luca's films, I didn't like this one."
back-to-black,lanmar,,". I don't think Amy would like this film,I think a lot of things were wrong or inaccurate, this ending didn't really suit me either"
anyone-but-you,lanmar,7,.Just a good and pleasant time spent at the cinema with my sister
priscilla,lanmar,6,". I love Sofia and her films,movie has a very comfortable feel to it,but something was missing in my opinion"
saltburn,lanmar,7,". Men are smart, nice, rich and psychopathic."
shrew,lanmar,2,. I think she should still contacta psychologist.
the-peasants-2023,lanmar,8,". I really liked film Loving Vincent, so I knew I would like this too. A great piece of work, great admiration, beautiful scenes, especially dancing ones, film is literally beautiful."
the-case-of-iwona-wieczorek,lanmar,,".Tak rozwikłaną sprawę moim zdaniem spokojnie można było odpowiedzieć, w większej ilości odcinków. Bardzo smutnosię patrzy na ludzi którychta sprawa dotknęła, mam nadzieję że kiedyś dowiedzą się prawdy, bo bardzo na to zasługą."
the-travelling-dog,lanmar,,".To this day, I wonder why I went to the cinema to see it."
the-little-mermaid-2023,lanmar,3,"I don't know why I watched it after I watched Oppenheimer but it was a real straight to ground. Totally not my vibes, bad movie."
gladiator-ii,antovolk,9,"I say again, #ReleaseTheBumAcheFactorCutStill good though"
paddington-in-peru,antovolk,,round 4 / final version round 1 / Dolby Atmos
anora,antovolk,9,"This review may contain spoilers. I can handle the truth.  if I wasn't losing it already, when the fucking TATU needle drop happens"
blitz-2024,antovolk,10,let filmmakers do their elevated blockbusters
joker-folie-a-deux,antovolk,8,"This review may contain spoilers. I can handle the truth.  Joker, Coda: The Death of Arthur Fleckactually so happy I knew going in, not of the death obviously but of the total fuck you nature of it, as someone who looking back still wasn't convinced by the intentions of the first film. here it's very clear and bless Philips for trying.side note, also bless Philips/Sher for thinking about 1.43 ""super IMAX"" (lol that's a fun term). the cropped framing in these sequences though? eh, that just made it a tad uncomfortable. here's to more zany experiments in the format"
napoleon-2023,antovolk,9,[the bum ache factor cut]fucking finally
disclaimer-2024,antovolk,8,E1+2
deadpool-wolverine,antovolk,8,"have to say, as much as the meta nature of it all is clearly grating some people - this is what made the multiverse shtick actually *work* in this one vs NWH or MOM. because if you wanna go *there*, at least this acknowledges the *why*. (Even if edges are sanded off)"
twisters,antovolk,9,half star extra for 4DX
little-forest,genyasapphic,10,"having a home & loved ones to return to, being able to cook for yourself & your loved ones, sharing a meal with old friends, feeling content & comfortable in your own presence, having a little forest of ur own… truly some of the greatest joys & blessings life has to offer omg my heart is so full :,) <3"
kamikaze-girls,genyasapphic,9,"this movie was literally made for me i don’t know what else to tell u guys like there’s lesbians & fashion & fun & so much love all of this is who i am & what i represent as person !!!! also momoko saying she felt like crying when she saw ichigo’s delight upon seeing the kamikaze embroidery she did for her omg so heart-warming she’s soooo me :,) <33"
reply-1988,genyasapphic,10,"i started rewatching this drama sometime during last year & made it a habit to watch a little part of an episode on days that felt too devoid love & light, days where warmth & comfort seemed to abandon my being, days where despair & fear bore too heavy on my shoulders & this beautiful drama never failed to offer me a refuge & a safe haven from the throes of my own miseries. life has actually been very kind to me lately, given how long…"
hana-and-alice,genyasapphic,8,when your circle small but your souls deeply & inextricably intertwined with one another !!! literally me n chanda <3
what-comes-after-love,genyasapphic,9,watching this drama during a time of the year when my mental health begins deteriorating has taken me to places i wouldn’t even go to without cyanide
skip-and-loafer,genyasapphic,10,shoujo so fawking good the hope makes a comeback omfg NEVER KILL YOURSELF
love-next-door-2024,genyasapphic,4,when that one dilf said “gay inmida” 🤯🤯🤯
big-little-lies,genyasapphic,9,oh this ATE despite being one of the whitest & most quintessential of yt ppl shows.. the finale episodes of both seasons had some of the most powerful & enthralling scenes in television history omg i’m so excited for season 3
kamli-2022,genyasapphic,9,"a harrowing tale of love & loss, grief & longing, subjugation & anguish, nostalgia & wistfulness that so artfully integrates local folklore, poetry, music & animal motifs on top of delivering stunning cinematography & visuals? me & all my fellow esoteric desi girls just collectively fell hard to our knees"
badhaai-do,genyasapphic,6,rimjhim you have bewitched me body & soul
dil-dhadakne-do,genyasapphic,8,"“i won’t ditch u, mangni announce hotay hi mein tumhe dump kar doon ga” SO FREAKING HILARIOUS I BUSTED A LUNG LAUGHING.. also i love love love the dynamic between ayesha & kabir cause that’s literally me & my bhai i love it when siblings are also silly little best friends <3"
the-glassworker,genyasapphic,8,my gluttonous ass went straight to bundu khan after i got out of the movie theatre & ate 5 gulab jamuns in a row.. anyways beautiful gorgeous stunning animation the ghibli girl in me was on cloud ninety-nine thousand !!!!! the movie is definitely not perfect but i’m gonna be generous & refrain from being too critical as it’s a big milestone for pakistani cinema & i’m hopeful we’ll improve with time but one thing that bugged me a lot was the lacklustre…
ran,hashbro,10,"Unparalleled! Unbeatable! Peak!Finally! Its been very long I was waiting to watch Ran and finish Kurosawa movies. I am glad I decided to watch Ran as the last one from his artography. What to say! My eyes are still Red, Yellow and Blue!Stunned! Amazed! Deeply Entertained!Just one name, Kurosawa 🔥❤️🤌His cinematography perspective is unmatchable. I have never seen such beautiful and meanigful frames like in Kurosawa movies. Mastery. Tatsuya Nakadai, his bestest of the best. What…"
maelstrom,hashbro,6,Great plot and performances. The idea of narration by a fish and the how the whole plot connects with so many fish is quite a concept. Execution gets a bit messy in between but the final act is so captivating. Denis Villenueve Ranked
your-monster-2024,hashbro,3,"Wildly stupid and unfunny! And definitely not horror!!!I want to give more marks for Melissa but the whole product is not letting me do it. She is such a talent, hope she selects better scripts. 2024 HollywoodTop 100: 2024"
